{
  "schemaVersion": "package-release-recovery-intent/v1",
  "releaseUnit": "example-browser-package",
  "channel": "prerelease",
  "version": "1.4.0-next.2",
  "originalIntentPath": ".github/release-intents/1.4.0-next.2.json",
  "failedAttempt": {
    "sourceCommit": "2222222222222222222222222222222222222222",
    "workflowRunUrl": "https://github.com/example/repository/actions/runs/123456789",
    "outcome": "terminal-failure",
    "mutationState": "not-started",
    "tagState": "absent",
    "registryVersionState": "absent"
  },
  "source": {
    "ref": "refs/heads/dev",
    "baseCommit": "3333333333333333333333333333333333333333"
  },
  "reason": "pre-mutation-no-immutable-identity"
}
